{
  "id": "550e8400-e29b-41d4-a716-446655440003",
  "type": "status.heartbeat",
  "version": "1.0.0",
  "timestamp": "2026-03-01T01:00:00.000Z",
  "sender": {
    "id": "agent-developer-001",
    "role": "developer",
    "status": "busy"
  },
  "payload": {
    "agentId": "agent-developer-001",
    "status": "busy",
    "currentTask": "task-feature-auth-001",
    "metrics": {
      "cpu": 78.2,
      "memory": 1024,
      "queueSize": 2
    }
  }
}