{
  "id": "550e8400-e29b-41d4-a716-446655440001",
  "type": "task.assign",
  "version": "1.0.0",
  "timestamp": "2026-03-01T01:00:00.000Z",
  "sender": {
    "id": "agent-manager-001",
    "role": "manager"
  },
  "payload": {
    "task": {
      "id": "task-bugfix-001",
      "type": "bugfix",
      "title": "修复登录超时问题",
      "status": "pending",
      "timestamps": {
        "createdAt": "2026-03-01T01:00:00.000Z"
      }
    }
  }
}