{
  "id": "550e8400-e29b-41d4-a716-446655440000",
  "type": "task.assign",
  "version": "1.0.0",
  "timestamp": "2026-03-01T01:00:00.000Z",
  "sender": {
    "id": "agent-manager-001",
    "role": "manager",
    "name": "Team Manager"
  },
  "recipient": {
    "id": "agent-developer-001",
    "role": "developer"
  },
  "payload": {
    "task": {
      "id": "task-feature-auth-001",
      "type": "feature",
      "title": "实现用户认证模块",
      "description": "添加 JWT 认证支持，包括登录、注册、令牌刷新功能",
      "status": "pending",
      "priority": "high",
      "tags": ["auth", "jwt", "security"],
      "estimatedMinutes": 120,
      "timestamps": {
        "createdAt": "2026-03-01T01:00:00.000Z",
        "deadline": "2026-03-02T01:00:00.000Z"
      },
      "context": {
        "branch": "feature/auth",
        "files": ["src/auth/", "src/middleware/auth.js"]
      }
    },
    "instructions": "请按照 TDD 方式开发，先写测试用例"
  },
  "metadata": {
    "priority": "high",
    "ttl": 3600,
    "tags": ["urgent", "sprint-1"]
  }
}