{
  "id": "550e8400-e29b-41d4-a716-446655440002",
  "type": "status.heartbeat",
  "version": "1.0.0",
  "timestamp": "2026-03-01T01:00:00.000Z",
  "sender": {
    "id": "agent-developer-001",
    "role": "developer",
    "status": "idle"
  },
  "payload": {
    "agentId": "agent-developer-001",
    "status": "idle",
    "metrics": {
      "cpu": 15.5,
      "memory": 512,
      "queueSize": 0
    }
  }
}